(1) _x000D_,(2) _x000D_,(3) _x000D_,(4) _x000D_,(5) _x000D_,Unnamed: 5,(6) _x000D_,(7) _x000D_,(8) _x000D_,Unnamed: 9
Sl. No. _x000D_,Name of the Project _x000D_,Item from the list of activities in schedule VII to the Act. _x000D_,Local area (Yes/ No). _x000D_,Location of the project. _x000D_,,Amount spent for the project (in ₹). _x000D_,Mode of implementation _x000D_- Direct (Yes/No) _x000D_,Mode of implementation -Through implementing agency. _x000D_,
,,,,State _x000D_,District _x000D_,,,Name. _x000D_,CSR _x000D_registration number. _x000D_
1. _x000D_,"Donation to Aimtron Foundation at Vadodara, Gujarat towards promotion of education. _x000D_",Education _x000D_,Yes _x000D_,Gujarat _x000D_,Vadodara _x000D_,"₹ 7,60,004/-_x000D_",No _x000D_,Aimtron Foundation Vadodara _x000D_,CSR00018332 _x000D_
2 _x000D_,Donation to Vishwamanidham Gurukulam _x000D_,Rehabilitation of Old age Home _x000D_,No _x000D_,Gujarat _x000D_,Rajkot _x000D_,"₹ 5,00,000/-_x000D_",No _x000D_,Vishwamanidham Gurukulam _x000D_,CSR00006907 _x000D_
3 _x000D_,Project executed by affiliating with Aimtron Foundation Preschool for promotion of education _x000D_,Education _x000D_,No _x000D_,Gujarat _x000D_,Rajkot _x000D_,"₹ 3,33,000/-_x000D_",Yes _x000D_,NA _x000D_,NA _x000D_
,,TOTAL _x000D_,,,,,"₹ 15,93,004/-_x000D_",,
